{"artifact_type":"delivery_provenance","decision":{"deck_delivery_decision_sha256":"d5b9c2b2112320bd1f08842bd4ad6330e1ee94887c2bbd4b42abf359869a1dd9","status":"pass"},"deck_id":"D03","delivery_files":{"d03-ppt_assets.zip":"ab637925dced86e33b69c09f64d3e904b86f579f3d7105505435d8f555614849","d03-ppt_deck_consistency_report.json":"b96412142784da721fefd4fb9b11921dc6348f33abcea16418005c213932c807","d03-ppt_delivery_decision.json":"467b7ea7c9e9c44a3c451f91cfa6b404868bfb1bb1ec62fdef90781dfc3ea882","d03-ppt_editable.pptx":"c50d82fd37b2b41880b0eb162e1ad68cd9865ae0e325de37abaa6a206158f81e","d03-ppt_previews.zip":"8abf58bea52141cc47eab5b926039e6b34b58aaa4d111502b3983f36a9ec027c","d03-ppt_qa_report.json":"f915f504ef6c51e9c173e943db7aabf68805d8c1669d3f5ef471e7edfdf2abc7"},"final_integrity":{"p5_final_render_manifest_sha256":"d0cd687e15ca2ea5dcae5d090ed176d63860e5a42dcb9d775cbfc2d06ecb3d96"},"p1_to_p4_authority":{"manifest_compatibility_status":"closed","p4_candidate_report_sha256":"f6c7c700300694186b11cbe341b1f0574597576dc72a0321ea7cf3ee1b9ce334","p4_drift_report_sha256":"846b384a098d4851862344c894cbf83a8e3e7de7370d2627cf5110ccda1b3196","p4_manifest_sha256":"0aaa65e97c578f653271e45edb32dcf8d6646dcc0ab56d78783c9cfe72944e34","p4_render_report_sha256":"2c6d654ede21ad15b585d131b0567b8470c760c60ee3063544c18cb36979da0d","p4_state_sha256":"8e10eb9160655d2b8db9f82d0fe0d36c9164ef79dbfceeaa98c9ea8c23c92a03"},"reviewer":{"deck_consistency_report_sha256":"fc00fb90f1bc5515d8d2128d59d928ee22b601ab555789ccd3d405b9527029fb","deck_reviewer_calls":0,"exception_reviewer_calls":0,"review_mode":"live","unexpected_reviewer_calls":0},"roundtrip":{"powerpoint_roundtrip_report_sha256":"0a124245d667a2d8d5e97a4fad044fc0235a33a38214a65e8a85dc19f1f744b8"},"runtime_lock":{"delivery_packaging_runtime_lock_sha256":"93b632552e07b5edfa1fb12eab1778cb78cf8bf5c9c54f02d1565dfcd1cd37c5"},"schema_version":"1.0"}
